{
  "architecture": "appservice",
  "azure_tags": {
    "application": "enterprise-hello",
    "domain": "data",
    "env": "dev",
    "managed_by": "terraform",
    "owner": "data-platform@example.com",
    "region": "swedencentral",
    "service": "hello-dbadapter-mysql",
    "team": "data-platform",
    "tier": "low"
  },
  "deprecated_sections": [],
  "display_name": "hello-dbadapter-mysql",
  "env": "dev",
  "identity": {
    "application": "enterprise-hello",
    "domain": "data",
    "env": "dev",
    "owner": "data-platform@example.com",
    "region": "swedencentral",
    "service": "hello-dbadapter-mysql",
    "team": "data-platform",
    "tier": "low"
  },
  "os_type": "linux",
  "package_version": "4.1.0",
  "presence_ref": "deploy-dbadapters.adapters.mysql.url",
  "resources": [
    {
      "id": "${contract:deploy-dbadapters.adapters.mysql.id}",
      "required": false,
      "role": "app",
      "tags": {
        "application": "enterprise-hello",
        "domain": "data",
        "env": "dev",
        "managed_by": "terraform",
        "owner": "data-platform_example.com",
        "region": "swedencentral",
        "service": "hello-dbadapter-mysql",
        "team": "data-platform",
        "tier": "low"
      },
      "tier": null,
      "type": "Microsoft.Web/sites"
    },
    {
      "id": "${contract:platform-db-mysql.server.id}",
      "required": false,
      "role": "store",
      "tags": {
        "application": "enterprise-hello",
        "domain": "data",
        "env": "dev",
        "managed_by": "terraform",
        "owner": "data-platform_example.com",
        "region": "swedencentral",
        "service": "hello-dbadapter-mysql",
        "team": "data-platform",
        "tier": "low"
      },
      "tier": null,
      "type": "Microsoft.DBforMySQL/flexibleServers"
    }
  ],
  "runtime": "python",
  "schema": "rendered-service/v2",
  "service": "hello-dbadapter-mysql",
  "source": "dev/hello-dbadapter-mysql.yaml",
  "source_sha256": "d2cc9069ad84b16a6ef61aea24c4c47568a5815f639ad8f726ebc0f36403b7b6",
  "tags": {
    "application": "enterprise-hello",
    "domain": "data",
    "env": "dev",
    "managed_by": "terraform",
    "owner": "data-platform_example.com",
    "region": "swedencentral",
    "service": "hello-dbadapter-mysql",
    "team": "data-platform",
    "tier": "low"
  },
  "telemetry": {
    "apm_mode": "policy",
    "apm_sample_rate": null,
    "dbm": null,
    "logs_route": "eventhub",
    "profiling": null,
    "rum": null
  }
}
