{
  "architecture": "functions",
  "azure_tags": {
    "application": "enterprise-hello",
    "domain": "fulfillment",
    "env": "dev",
    "managed_by": "terraform",
    "owner": "fulfillment@example.com",
    "region": "swedencentral",
    "service": "hello-durable",
    "team": "fulfillment",
    "tier": "critical"
  },
  "deprecated_sections": [],
  "display_name": "hello-durable",
  "env": "dev",
  "identity": {
    "application": "enterprise-hello",
    "domain": "fulfillment",
    "env": "dev",
    "owner": "fulfillment@example.com",
    "region": "swedencentral",
    "service": "hello-durable",
    "team": "fulfillment",
    "tier": "critical"
  },
  "os_type": "linux",
  "package_version": "4.1.0",
  "presence_ref": "deploy-durable.function_app.id",
  "resources": [
    {
      "id": "${contract:deploy-durable.function_app.id}",
      "required": false,
      "role": "app",
      "tags": {
        "application": "enterprise-hello",
        "domain": "fulfillment",
        "env": "dev",
        "managed_by": "terraform",
        "owner": "fulfillment_example.com",
        "region": "swedencentral",
        "service": "hello-durable",
        "team": "fulfillment",
        "tier": "critical"
      },
      "tier": null,
      "type": "Microsoft.Web/sites"
    },
    {
      "id": "${contract:platform-db-sql.databases.fulfillment.id}",
      "required": true,
      "role": "fulfillment-db",
      "tags": {
        "application": "enterprise-hello",
        "domain": "fulfillment",
        "env": "dev",
        "managed_by": "terraform",
        "owner": "fulfillment_example.com",
        "region": "swedencentral",
        "service": "hello-durable",
        "team": "fulfillment",
        "tier": "critical"
      },
      "tier": null,
      "type": "Microsoft.Sql/servers/databases"
    },
    {
      "id": "${contract:platform-messaging.namespace_id}",
      "required": true,
      "role": "servicebus",
      "tags": {
        "application": "enterprise-hello",
        "domain": "fulfillment",
        "env": "dev",
        "managed_by": "terraform",
        "owner": "fulfillment_example.com",
        "region": "swedencentral",
        "service": "hello-durable",
        "team": "fulfillment",
        "tier": "critical"
      },
      "tier": null,
      "type": "Microsoft.ServiceBus/namespaces"
    }
  ],
  "runtime": "dotnet",
  "schema": "rendered-service/v2",
  "service": "hello-durable",
  "source": "dev/hello-durable.yaml",
  "source_sha256": "7bb843aa33b9f68e07952573dc558c9c1cba50ffa930b77d0254c8c775212883",
  "tags": {
    "application": "enterprise-hello",
    "domain": "fulfillment",
    "env": "dev",
    "managed_by": "terraform",
    "owner": "fulfillment_example.com",
    "region": "swedencentral",
    "service": "hello-durable",
    "team": "fulfillment",
    "tier": "critical"
  },
  "telemetry": {
    "apm_mode": "policy",
    "apm_sample_rate": null,
    "dbm": null,
    "logs_route": "eventhub",
    "profiling": null,
    "rum": null
  }
}
