{
  "architecture": "aca",
  "azure_tags": {
    "application": "enterprise-hello",
    "domain": "data",
    "env": "dev",
    "managed_by": "terraform",
    "owner": "data-platform@example.com",
    "region": "swedencentral",
    "service": "hello-dbadapter-cassandra-mi",
    "team": "data-platform",
    "tier": "low"
  },
  "deprecated_sections": [],
  "display_name": "hello-dbadapter-cassandra-mi",
  "env": "dev",
  "identity": {
    "application": "enterprise-hello",
    "domain": "data",
    "env": "dev",
    "owner": "data-platform@example.com",
    "region": "swedencentral",
    "service": "hello-dbadapter-cassandra-mi",
    "team": "data-platform",
    "tier": "low"
  },
  "os_type": "linux",
  "package_version": "4.1.0",
  "presence_ref": "deploy-dbadapters.adapters.cassandra-mi.url",
  "resources": [
    {
      "id": "${contract:deploy-dbadapters.adapters.cassandra-mi.id}",
      "required": false,
      "role": "app",
      "tags": {
        "application": "enterprise-hello",
        "domain": "data",
        "env": "dev",
        "managed_by": "terraform",
        "owner": "data-platform_example.com",
        "region": "swedencentral",
        "service": "hello-dbadapter-cassandra-mi",
        "team": "data-platform",
        "tier": "low"
      },
      "tier": null,
      "type": "Microsoft.App/containerApps"
    },
    {
      "id": "${contract:platform-db-cassandra-mi.cluster.id}",
      "required": false,
      "role": "store",
      "tags": {
        "application": "enterprise-hello",
        "domain": "data",
        "env": "dev",
        "managed_by": "terraform",
        "owner": "data-platform_example.com",
        "region": "swedencentral",
        "service": "hello-dbadapter-cassandra-mi",
        "team": "data-platform",
        "tier": "low"
      },
      "tier": null,
      "type": "Microsoft.DocumentDB/cassandraClusters"
    }
  ],
  "runtime": "python",
  "schema": "rendered-service/v2",
  "service": "hello-dbadapter-cassandra-mi",
  "source": "dev/hello-dbadapter-cassandra-mi.yaml",
  "source_sha256": "aa94a052c879f8e78a2e196a0e3376bbcc7290e5014d3c2da5276ba2982add5c",
  "tags": {
    "application": "enterprise-hello",
    "domain": "data",
    "env": "dev",
    "managed_by": "terraform",
    "owner": "data-platform_example.com",
    "region": "swedencentral",
    "service": "hello-dbadapter-cassandra-mi",
    "team": "data-platform",
    "tier": "low"
  },
  "telemetry": {
    "apm_mode": "policy",
    "apm_sample_rate": null,
    "dbm": null,
    "logs_route": "sidecar",
    "profiling": null,
    "rum": null
  }
}
