{
  "architecture": "swa",
  "azure_tags": {
    "application": "enterprise-hello",
    "domain": "storefront",
    "env": "dev",
    "managed_by": "terraform",
    "owner": "web@example.com",
    "region": "swedencentral",
    "service": "hello-frontend",
    "team": "web",
    "tier": "high"
  },
  "deprecated_sections": [],
  "display_name": "hello-frontend",
  "env": "dev",
  "identity": {
    "application": "enterprise-hello",
    "domain": "storefront",
    "env": "dev",
    "owner": "web@example.com",
    "region": "swedencentral",
    "service": "hello-frontend",
    "team": "web",
    "tier": "high"
  },
  "os_type": "linux",
  "package_version": "4.1.0",
  "presence_ref": "deploy-frontend.url",
  "resources": [],
  "runtime": "browser",
  "schema": "rendered-service/v2",
  "service": "hello-frontend",
  "source": "dev/hello-frontend.yaml",
  "source_sha256": "ba993fc85d82b99bcd9f3b8bdbd3b12ea6adbde53bdda0e0e810dfcc1b54d76b",
  "tags": {
    "application": "enterprise-hello",
    "domain": "storefront",
    "env": "dev",
    "managed_by": "terraform",
    "owner": "web_example.com",
    "region": "swedencentral",
    "service": "hello-frontend",
    "team": "web",
    "tier": "high"
  },
  "telemetry": {
    "apm_mode": "policy",
    "apm_sample_rate": null,
    "dbm": null,
    "logs_route": "none",
    "profiling": null,
    "rum": {
      "application_ref": "obs-prereqs.rum.applications.hello-frontend.application_id",
      "enabled": true
    }
  }
}
