{
  "architecture": "aca",
  "azure_tags": {
    "application": "enterprise-hello",
    "domain": "observability",
    "env": "dev",
    "managed_by": "terraform",
    "owner": "observability@example.com",
    "region": "swedencentral",
    "service": "telemetry-pipeline",
    "team": "observability",
    "tier": "critical"
  },
  "deprecated_sections": [],
  "display_name": "telemetry-pipeline",
  "env": "dev",
  "identity": {
    "application": "enterprise-hello",
    "domain": "observability",
    "env": "dev",
    "owner": "observability@example.com",
    "region": "swedencentral",
    "service": "telemetry-pipeline",
    "team": "observability",
    "tier": "critical"
  },
  "os_type": "linux",
  "package_version": "4.1.0",
  "presence_ref": "obs-telemetry-transport.otlp.grpc_endpoint",
  "resources": [
    {
      "id": "${contract:obs-telemetry-transport.event_hub.namespace_id}",
      "required": false,
      "role": "log-export",
      "tags": {
        "application": "enterprise-hello",
        "domain": "observability",
        "env": "dev",
        "managed_by": "terraform",
        "owner": "observability_example.com",
        "region": "swedencentral",
        "service": "telemetry-pipeline",
        "team": "observability",
        "tier": "critical"
      },
      "tier": null,
      "type": "Microsoft.EventHub/namespaces"
    }
  ],
  "runtime": "other",
  "schema": "rendered-service/v2",
  "service": "telemetry-pipeline",
  "source": "dev/telemetry-pipeline.yaml",
  "source_sha256": "aaac3722d9a01f3014d29557e028e95ea2f1fcf306b853b15cee1173c54333dd",
  "tags": {
    "application": "enterprise-hello",
    "domain": "observability",
    "env": "dev",
    "managed_by": "terraform",
    "owner": "observability_example.com",
    "region": "swedencentral",
    "service": "telemetry-pipeline",
    "team": "observability",
    "tier": "critical"
  },
  "telemetry": {
    "apm_mode": "policy",
    "apm_sample_rate": null,
    "dbm": null,
    "logs_route": "sidecar",
    "profiling": null,
    "rum": null
  }
}
