{
  "architecture": "external",
  "azure_tags": {
    "application": "platform",
    "domain": "observability",
    "env": "prod",
    "managed_by": "terraform",
    "owner": "platform@contoso.example",
    "region": "westeurope",
    "service": "telemetry-pipeline",
    "team": "platform",
    "tier": "high"
  },
  "deprecated_sections": [],
  "display_name": "telemetry-pipeline",
  "env": "prod",
  "identity": {
    "application": "platform",
    "domain": "observability",
    "env": "prod",
    "owner": "platform@contoso.example",
    "region": "westeurope",
    "service": "telemetry-pipeline",
    "team": "platform",
    "tier": "high"
  },
  "os_type": "linux",
  "package_version": "4.1.0",
  "presence_ref": null,
  "resources": [],
  "runtime": "other",
  "schema": "rendered-service/v2",
  "service": "telemetry-pipeline",
  "source": "prod/telemetry-pipeline.yaml",
  "source_sha256": "17494ace02c04e86ed2e52b28a74c5498f0f5c2459cbb1b56c10718796657ae5",
  "tags": {
    "application": "platform",
    "domain": "observability",
    "env": "prod",
    "managed_by": "terraform",
    "owner": "platform_contoso.example",
    "region": "westeurope",
    "service": "telemetry-pipeline",
    "team": "platform",
    "tier": "high"
  },
  "telemetry": {
    "apm_mode": "policy",
    "apm_sample_rate": null,
    "dbm": null,
    "logs_route": "none",
    "profiling": null,
    "rum": null
  }
}
