{
  "architecture": "aca",
  "azure_tags": {
    "application": "enterprise-hello",
    "domain": "fulfillment",
    "env": "dev",
    "managed_by": "terraform",
    "owner": "fulfillment@example.com",
    "region": "swedencentral",
    "service": "hello-jobs",
    "team": "fulfillment",
    "tier": "low"
  },
  "deprecated_sections": [],
  "display_name": "hello-jobs",
  "env": "dev",
  "identity": {
    "application": "enterprise-hello",
    "domain": "fulfillment",
    "env": "dev",
    "owner": "fulfillment@example.com",
    "region": "swedencentral",
    "service": "hello-jobs",
    "team": "fulfillment",
    "tier": "low"
  },
  "os_type": "linux",
  "package_version": "4.1.0",
  "presence_ref": "deploy-jobs.jobs.seed.id",
  "resources": [],
  "runtime": "python",
  "schema": "rendered-service/v2",
  "service": "hello-jobs",
  "source": "dev/hello-jobs.yaml",
  "source_sha256": "149bb1b62bdf91ab602dcb77d33c3cea6d0da885db632d1aad6b538166581184",
  "tags": {
    "application": "enterprise-hello",
    "domain": "fulfillment",
    "env": "dev",
    "managed_by": "terraform",
    "owner": "fulfillment_example.com",
    "region": "swedencentral",
    "service": "hello-jobs",
    "team": "fulfillment",
    "tier": "low"
  },
  "telemetry": {
    "apm_mode": "policy",
    "apm_sample_rate": null,
    "dbm": null,
    "logs_route": "sidecar",
    "profiling": null,
    "rum": null
  }
}
