{
  "architecture": "external",
  "azure_tags": {
    "application": "enterprise-hello",
    "domain": "observability",
    "env": "dev",
    "managed_by": "terraform",
    "owner": "observability@example.com",
    "region": "swedencentral",
    "service": "azure-platform-logs",
    "team": "observability",
    "tier": "high"
  },
  "deprecated_sections": [],
  "display_name": "Azure platform logs",
  "env": "dev",
  "identity": {
    "application": "enterprise-hello",
    "domain": "observability",
    "env": "dev",
    "owner": "observability@example.com",
    "region": "swedencentral",
    "service": "azure-platform-logs",
    "team": "observability",
    "tier": "high"
  },
  "os_type": "linux",
  "package_version": "4.1.0",
  "presence_ref": "obs-telemetry-transport.event_hub.namespace_id",
  "resources": [],
  "runtime": "other",
  "schema": "rendered-service/v2",
  "service": "azure-platform-logs",
  "source": "dev/azure-platform-logs.yaml",
  "source_sha256": "4a4b830576c6ec5257ce8e8ac42349a45cfd34a48e7ac6ba39a9a74edfd5628a",
  "tags": {
    "application": "enterprise-hello",
    "domain": "observability",
    "env": "dev",
    "managed_by": "terraform",
    "owner": "observability_example.com",
    "region": "swedencentral",
    "service": "azure-platform-logs",
    "team": "observability",
    "tier": "high"
  },
  "telemetry": {
    "apm_mode": "policy",
    "apm_sample_rate": null,
    "dbm": null,
    "logs_route": "none",
    "profiling": null,
    "rum": null
  }
}
