{
  "architecture": "aks",
  "azure_tags": {
    "application": "enterprise-hello",
    "domain": "notifications",
    "env": "dev",
    "managed_by": "terraform",
    "owner": "fulfillment@example.com",
    "region": "swedencentral",
    "service": "hello-worker",
    "team": "fulfillment",
    "tier": "medium"
  },
  "deprecated_sections": [],
  "display_name": "hello-worker",
  "env": "dev",
  "identity": {
    "application": "enterprise-hello",
    "domain": "notifications",
    "env": "dev",
    "owner": "fulfillment@example.com",
    "region": "swedencentral",
    "service": "hello-worker",
    "team": "fulfillment",
    "tier": "medium"
  },
  "os_type": "linux",
  "package_version": "4.1.0",
  "presence_ref": "deploy-core-aks.apps.hello-worker.id",
  "resources": [
    {
      "id": "${contract:platform-messaging.namespace_id}",
      "required": true,
      "role": "servicebus",
      "tags": {
        "application": "enterprise-hello",
        "domain": "notifications",
        "env": "dev",
        "managed_by": "terraform",
        "owner": "fulfillment_example.com",
        "region": "swedencentral",
        "service": "hello-worker",
        "team": "fulfillment",
        "tier": "medium"
      },
      "tier": null,
      "type": "Microsoft.ServiceBus/namespaces"
    },
    {
      "id": "${contract:platform-db-table-storage.account.id}",
      "required": false,
      "role": "table-store",
      "tags": {
        "application": "enterprise-hello",
        "domain": "notifications",
        "env": "dev",
        "managed_by": "terraform",
        "owner": "fulfillment_example.com",
        "region": "swedencentral",
        "service": "hello-worker",
        "team": "fulfillment",
        "tier": "medium"
      },
      "tier": null,
      "type": "Microsoft.Storage/storageAccounts"
    }
  ],
  "runtime": "python",
  "schema": "rendered-service/v2",
  "service": "hello-worker",
  "source": "dev/hello-worker.yaml",
  "source_sha256": "f8a3e25987b8deeab932eebb28569c2dea371346a9662d14ad68b9b8e6a65786",
  "tags": {
    "application": "enterprise-hello",
    "domain": "notifications",
    "env": "dev",
    "managed_by": "terraform",
    "owner": "fulfillment_example.com",
    "region": "swedencentral",
    "service": "hello-worker",
    "team": "fulfillment",
    "tier": "medium"
  },
  "telemetry": {
    "apm_mode": "policy",
    "apm_sample_rate": null,
    "dbm": null,
    "logs_route": "daemonset",
    "profiling": null,
    "rum": null
  }
}
