{
  "architecture": "aci",
  "azure_tags": {
    "application": "enterprise-hello",
    "domain": "payments",
    "env": "dev",
    "managed_by": "terraform",
    "owner": "fulfillment@example.com",
    "region": "swedencentral",
    "service": "hello-partner-sim",
    "team": "fulfillment",
    "tier": "low"
  },
  "deprecated_sections": [],
  "display_name": "hello-partner-sim",
  "env": "dev",
  "identity": {
    "application": "enterprise-hello",
    "domain": "payments",
    "env": "dev",
    "owner": "fulfillment@example.com",
    "region": "swedencentral",
    "service": "hello-partner-sim",
    "team": "fulfillment",
    "tier": "low"
  },
  "os_type": "linux",
  "package_version": "4.1.0",
  "presence_ref": "deploy-partner-sim.url",
  "resources": [
    {
      "id": "${contract:deploy-partner-sim.container_group.id}",
      "required": false,
      "role": "group",
      "tags": {
        "application": "enterprise-hello",
        "domain": "payments",
        "env": "dev",
        "managed_by": "terraform",
        "owner": "fulfillment_example.com",
        "region": "swedencentral",
        "service": "hello-partner-sim",
        "team": "fulfillment",
        "tier": "low"
      },
      "tier": null,
      "type": "Microsoft.ContainerInstance/containerGroups"
    }
  ],
  "runtime": "python",
  "schema": "rendered-service/v2",
  "service": "hello-partner-sim",
  "source": "dev/hello-partner-sim.yaml",
  "source_sha256": "494673d28681f706e756ef00e9e638aee41392f11d8970cd71c834a7e119781e",
  "tags": {
    "application": "enterprise-hello",
    "domain": "payments",
    "env": "dev",
    "managed_by": "terraform",
    "owner": "fulfillment_example.com",
    "region": "swedencentral",
    "service": "hello-partner-sim",
    "team": "fulfillment",
    "tier": "low"
  },
  "telemetry": {
    "apm_mode": "policy",
    "apm_sample_rate": null,
    "dbm": null,
    "logs_route": "sidecar",
    "profiling": null,
    "rum": null
  }
}
