{
  "architecture": "aca",
  "azure_tags": {
    "application": "enterprise-hello",
    "domain": "data",
    "env": "dev",
    "managed_by": "terraform",
    "owner": "data-platform@example.com",
    "region": "swedencentral",
    "service": "hello-dbadapter-table-storage",
    "team": "data-platform",
    "tier": "low"
  },
  "deprecated_sections": [],
  "display_name": "hello-dbadapter-table-storage",
  "env": "dev",
  "identity": {
    "application": "enterprise-hello",
    "domain": "data",
    "env": "dev",
    "owner": "data-platform@example.com",
    "region": "swedencentral",
    "service": "hello-dbadapter-table-storage",
    "team": "data-platform",
    "tier": "low"
  },
  "os_type": "linux",
  "package_version": "4.1.0",
  "presence_ref": "deploy-dbadapters.adapters.table-storage.url",
  "resources": [
    {
      "id": "${contract:deploy-dbadapters.adapters.table-storage.id}",
      "required": false,
      "role": "app",
      "tags": {
        "application": "enterprise-hello",
        "domain": "data",
        "env": "dev",
        "managed_by": "terraform",
        "owner": "data-platform_example.com",
        "region": "swedencentral",
        "service": "hello-dbadapter-table-storage",
        "team": "data-platform",
        "tier": "low"
      },
      "tier": null,
      "type": "Microsoft.App/containerApps"
    },
    {
      "id": "${contract:platform-db-table-storage.account.id}",
      "required": false,
      "role": "store-table",
      "tags": {
        "application": "enterprise-hello",
        "domain": "data",
        "env": "dev",
        "managed_by": "terraform",
        "owner": "data-platform_example.com",
        "region": "swedencentral",
        "service": "hello-dbadapter-table-storage",
        "team": "data-platform",
        "tier": "low"
      },
      "tier": null,
      "type": "Microsoft.Storage/storageAccounts"
    }
  ],
  "runtime": "python",
  "schema": "rendered-service/v2",
  "service": "hello-dbadapter-table-storage",
  "source": "dev/hello-dbadapter-table-storage.yaml",
  "source_sha256": "ef618ed7eab48f4cef7dbe5fe8501246d4f90a32c7f9c1e337aec78a7a782f9c",
  "tags": {
    "application": "enterprise-hello",
    "domain": "data",
    "env": "dev",
    "managed_by": "terraform",
    "owner": "data-platform_example.com",
    "region": "swedencentral",
    "service": "hello-dbadapter-table-storage",
    "team": "data-platform",
    "tier": "low"
  },
  "telemetry": {
    "apm_mode": "policy",
    "apm_sample_rate": null,
    "dbm": null,
    "logs_route": "sidecar",
    "profiling": null,
    "rum": null
  }
}
