{
  "architecture": "appservice",
  "azure_tags": {
    "application": "orders",
    "domain": "commerce",
    "env": "prod",
    "managed_by": "terraform",
    "owner": "orders-team@contoso.example",
    "region": "westeurope",
    "service": "orders-web",
    "team": "orders",
    "tier": "high"
  },
  "deprecated_sections": [],
  "display_name": "Orders web",
  "env": "prod",
  "identity": {
    "application": "orders",
    "domain": "commerce",
    "env": "prod",
    "owner": "orders-team@contoso.example",
    "region": "westeurope",
    "service": "orders-web",
    "team": "orders",
    "tier": "high"
  },
  "os_type": "linux",
  "package_version": "4.1.0",
  "presence_ref": null,
  "resources": [
    {
      "id": "/subscriptions/00000000-0000-0000-0000-000000000000/resourceGroups/rg-orders-prod/providers/Microsoft.Web/sites/app-orders-web-prod",
      "required": true,
      "role": "app",
      "tags": {
        "application": "orders",
        "domain": "commerce",
        "env": "prod",
        "managed_by": "terraform",
        "owner": "orders-team_contoso.example",
        "region": "westeurope",
        "service": "orders-web",
        "team": "orders",
        "tier": "high"
      },
      "tier": null,
      "type": "Microsoft.Web/sites"
    }
  ],
  "runtime": "dotnet",
  "schema": "rendered-service/v2",
  "service": "orders-web",
  "source": "prod/orders-web.yaml",
  "source_sha256": "745b46c296633620b0e5d2e1c07de4a5063b35bc605a1895a33ffccd5555c48a",
  "tags": {
    "application": "orders",
    "domain": "commerce",
    "env": "prod",
    "managed_by": "terraform",
    "owner": "orders-team_contoso.example",
    "region": "westeurope",
    "service": "orders-web",
    "team": "orders",
    "tier": "high"
  },
  "telemetry": {
    "apm_mode": "policy",
    "apm_sample_rate": null,
    "dbm": null,
    "logs_route": "eventhub",
    "profiling": null,
    "rum": null
  }
}
