{
  "architecture": "vmss",
  "azure_tags": {
    "application": "enterprise-hello",
    "domain": "data",
    "env": "dev",
    "managed_by": "terraform",
    "owner": "data-platform@example.com",
    "region": "swedencentral",
    "service": "hello-dbadapter-sqlvm",
    "team": "data-platform",
    "tier": "low"
  },
  "deprecated_sections": [],
  "display_name": "hello-dbadapter-sqlvm",
  "env": "dev",
  "identity": {
    "application": "enterprise-hello",
    "domain": "data",
    "env": "dev",
    "owner": "data-platform@example.com",
    "region": "swedencentral",
    "service": "hello-dbadapter-sqlvm",
    "team": "data-platform",
    "tier": "low"
  },
  "os_type": "linux",
  "package_version": "4.1.0",
  "presence_ref": "deploy-dbadapters.adapters.sqlvm.url",
  "resources": [
    {
      "id": "${contract:deploy-dbadapters.adapters.sqlvm.id}",
      "required": false,
      "role": "app",
      "tags": {
        "application": "enterprise-hello",
        "domain": "data",
        "env": "dev",
        "managed_by": "terraform",
        "owner": "data-platform_example.com",
        "region": "swedencentral",
        "service": "hello-dbadapter-sqlvm",
        "team": "data-platform",
        "tier": "low"
      },
      "tier": null,
      "type": "Microsoft.Compute/virtualMachineScaleSets"
    },
    {
      "id": "${contract:platform-db-sqlvm.vm.id}",
      "required": false,
      "role": "store",
      "tags": {
        "application": "enterprise-hello",
        "domain": "data",
        "env": "dev",
        "managed_by": "terraform",
        "owner": "data-platform_example.com",
        "region": "swedencentral",
        "service": "hello-dbadapter-sqlvm",
        "team": "data-platform",
        "tier": "low"
      },
      "tier": null,
      "type": "Microsoft.Compute/virtualMachines"
    }
  ],
  "runtime": "python",
  "schema": "rendered-service/v2",
  "service": "hello-dbadapter-sqlvm",
  "source": "dev/hello-dbadapter-sqlvm.yaml",
  "source_sha256": "99dad5d386fa87341c0db87d45f2c12643835b8e1ef03ebb59cb4884f13f14e6",
  "tags": {
    "application": "enterprise-hello",
    "domain": "data",
    "env": "dev",
    "managed_by": "terraform",
    "owner": "data-platform_example.com",
    "region": "swedencentral",
    "service": "hello-dbadapter-sqlvm",
    "team": "data-platform",
    "tier": "low"
  },
  "telemetry": {
    "apm_mode": "policy",
    "apm_sample_rate": null,
    "dbm": null,
    "logs_route": "host",
    "profiling": null,
    "rum": null
  }
}
